{
  "screen": "Usage billing dashboard",
  "audience": "startup founder",
  "userGoal": "Understand current usage before upgrading",
  "primaryAction": "Upgrade plan",
  "patterns": ["app shell", "summary cards", "tabs", "usage chart placeholder", "data table", "pricing table", "modal", "filter bar"],
  "requiredStates": ["default", "empty", "over-limit", "success"],
  "requiredInteractions": ["tabs", "modal", "filter"]
}
